{
  "code": "S",
  "sourceRevision": 1,
  "name": "Серин",
  "info": "Гидроксильная группа образует водородные связи и может фосфорилироваться.",
  "feature": "Гидроксильная группа",
  "history": {
    "clue": "Название происходит от латинского слова «шёлк».",
    "story": "В 1865 году Эмиль Крамер впервые получил серин из белка шёлка. Отсюда и название: латинское sericum означает «шёлк». Источник выделения превратился в имя аминокислоты, которая встречается и во множестве других белков."
  },
  "links": {
    "wikipedia": "https://ru.wikipedia.org/wiki/Серин"
  }
}
