{
  "code": "R",
  "sourceRevision": 2,
  "name": "Аргинин",
  "info": "Гуанидиновая группа преимущественно положительна при pH около 7. Условно незаменим, особенно в период роста.",
  "feature": "Гуанидиновая группа",
  "history": {
    "clue": "Впервые выделена из проростков люпина Шульце и Штайгером в 1886 году.",
    "story": "В 1886 году Эрнст Шульце и Эрнст Штайгер выделили аргинин из проростков люпина. Они исследовали азотсодержащие вещества растений, осаждая и очищая их соединения. Люпин помог открыть и другую аминокислоту — фенилаланин, описанный Шульце и Барбьери в 1879 году."
  },
  "links": {
    "wikipedia": "https://ru.wikipedia.org/wiki/Аргинин"
  }
}
