{
  "code": "M",
  "sourceRevision": 2,
  "name": "Метионин",
  "info": "Содержит серу в тиоэфире. В отличие от цистеина не образует дисульфидные мостики.",
  "feature": "Тиоэфир",
  "history": {
    "clue": "Название сокращает описание метилсодержащего серного фрагмента.",
    "story": "В 1921 году Джон Говард Мюллер выделил из казеина новую серосодержащую аминокислоту. В 1928 году Баргер и Койн установили её строение и предложили название «метионин». Оно сокращает описание фрагмента –S–CH₃: «мет-» связано с метилом, «тио-» — с серой."
  },
  "links": {
    "wikipedia": "https://ru.wikipedia.org/wiki/Метионин"
  }
}
