{
  "code": "U",
  "sourceRevision": 1,
  "name": "Селеноцистеин",
  "info": "21-я генетически кодируемая аминокислота. Включается при специальном прочтении UGA; при pH около 7 боковая цепь преимущественно отрицательна.",
  "feature": "Содержит селен",
  "history": {
    "clue": "Название указывает на аналог цистеина с селеном вместо серы.",
    "story": "Название селеноцистеина описывает его строение: это аналог цистеина с селеном вместо серы. Исследования Тересы Штадтман помогли установить роль селена в белках. В 1986 году выяснилось, что в генах некоторых селенсодержащих ферментов на месте этой аминокислоты стоит UGA — кодон, обычно означающий остановку синтеза."
  },
  "links": {
    "wikipedia": "https://ru.wikipedia.org/wiki/Селеноцистеин"
  },
  "codonNote": "UGA обычно является стоп-кодоном. Селеноцистеин включается при специальном прочтении UGA с участием дополнительных сигналов и факторов."
}
