{
  "code": "D",
  "sourceRevision": 2,
  "name": "Аспарагиновая кислота",
  "info": "При pH около 7 боковой карбоксилат преимущественно отрицателен. Ионизированная форма — аспартат.",
  "feature": "Кислый радикал",
  "history": {
    "clue": "Впервые получена гидролизом аспарагина; название сохраняет связь с ним.",
    "story": "В 1827 году аспарагиновую кислоту получили гидролизом уже известного аспарагина. При этом боковая амидная группа превращается в карбоксильную. Название сохранило родство с аспарагином и через него — со спаржей, из сока которой тот был выделен."
  },
  "links": {
    "wikipedia": "https://ru.wikipedia.org/wiki/Аспарагиновая_кислота"
  }
}
