{
  "code": "O",
  "sourceRevision": 2,
  "name": "Пирролизин",
  "info": "22-я генетически кодируемая аминокислота у некоторых архей и бактерий. ε-Аминогруппа лизинового фрагмента образует амидную связь с метилпирролинкарбонильным фрагментом. Включается при специальном прочтении UAG.",
  "feature": "Редкая кодируемая",
  "history": {
    "clue": "В 2002 году обнаружена в метилтрансферазе метанобразующей археи.",
    "story": "В 2002 году пирролизин обнаружили в активном центре метилтрансферазы метанобразующей археи Methanosarcina barkeri. Необычный остаток увидели при исследовании пространственной структуры фермента. Название объединяет пирролиновое кольцо и лизиновый фрагмент. Пирролизин стал 22-й известной генетически кодируемой аминокислотой."
  },
  "links": {
    "wikipedia": "https://ru.wikipedia.org/wiki/Пирролизин"
  },
  "sideLabel": "(CH₂)₄–NH–C(=O)–метилпирролиновое кольцо"
}
