{
  "code": "G",
  "sourceRevision": 2,
  "name": "Глицин",
  "info": "Единственная стандартная аминокислота без хирального центра. Маленький радикал даёт цепи гибкость.",
  "feature": "Ахиральная",
  "history": {
    "clue": "Название происходит от греческого слова «сладкий».",
    "story": "В 1820 году Анри Браконно получил глицин при расщеплении желатина. Название происходит от греческого glykys — «сладкий», по вкусу кристаллов. Почти два века спустя глицин обнаружил аппарат Rosetta в газопылевой оболочке кометы Чурюмова — Герасименко; результаты опубликовали в 2016 году."
  },
  "links": {
    "wikipedia": "https://ru.wikipedia.org/wiki/Глицин"
  }
}
