{
  "code": "C",
  "sourceRevision": 2,
  "name": "Цистеин",
  "info": "Тиольные группы двух цистеинов при окислении образуют дисульфидный мостик. Синтез зависит от доступности метионина.",
  "feature": "Тиольная группа; при окислении образует дисульфидные мостики",
  "history": {
    "clue": "Название образовано от цистина, ранее найденного в камнях мочевого пузыря.",
    "story": "История началась в 1810 году: Уильям Волластон обнаружил цистин в камнях мочевого пузыря. Греческое kystis — «мочевой пузырь» — дало веществу название. В 1884 году Ойген Бауман восстановил цистин и получил цистеин, сохранив в имени связь с исходным соединением. Две молекулы цистеина при окислении могут вновь образовать цистин."
  },
  "links": {
    "wikipedia": "https://ru.wikipedia.org/wiki/Цистеин"
  }
}
