{
  "code": "E",
  "sourceRevision": 1,
  "name": "Глутаминовая кислота",
  "info": "При pH около 7 боковой карбоксилат преимущественно отрицателен. Ионизированная форма — глутамат.",
  "feature": "Кислый радикал",
  "history": {
    "clue": "Название связано с глютеном, из которого вещество впервые выделили.",
    "story": "В 1866 году Карл Риттхаузен выделил глутаминовую кислоту из пшеничного глютена — клейковины, давшей ей имя. В 1908 году Кикунаэ Икеда установил, что глутамат придаёт бульону из водорослей комбу характерный вкус. Он назвал этот вкус «умами». Так одна аминокислота связала историю химии белков с японской кухней."
  },
  "links": {
    "wikipedia": "https://ru.wikipedia.org/wiki/Глутаминовая_кислота"
  }
}
