{
  "code": "H",
  "sourceRevision": 2,
  "name": "Гистидин",
  "info": "Основная аминокислота. При pH около 7 имидазол преимущественно нейтрален; pKa около 6, заряд зависит от окружения.",
  "feature": "Имидазольное кольцо",
  "history": {
    "clue": "Название содержит корень histo-, связанный с тканями.",
    "story": "Корень histo- связан с греческим histos — «ткань, полотно», как в слове «гистология». Гистидин независимо выделили Альбрехт Коссель и Свен Густав Гедин в 1896 году. Коссель позднее получил Нобелевскую премию за исследования химического состава клеток, включая белки и нуклеиновые вещества."
  },
  "links": {
    "wikipedia": "https://ru.wikipedia.org/wiki/Гистидин"
  }
}
